{
  "schema_version": "amp_reduced.meta/v1",
  "formcalc_version": "10.0",
  "form_version": "4.3.1",
  "looptools_version": "10.0",
  "gamma5_scheme": "naive",
  "pv_heads": "formcalc-native",
  "abbreviations_manifest": "",
  "input_hashes": {
    "feynamplist_m": "__TO_BE_COMPUTED__",
    "processspec_json": "__TO_BE_COMPUTED__"
  },
  "kinematic_limit": "general",
  "ir_flags": {
    "ir_divergent": false,
    "uv_regularized": false
  },
  "caveats": [],
  "produced_at": "__TIMESTAMP__",
  "wolfram_version_major_minor": "14.0"
}
